{
  "name": "qui non Lorem adipisicing do",
  "id": null,
  "paymentPolicyStatus": "adipisicing elit reprehenderit cillum",
  "description": "in tempor nisi",
  "paymentPolicyTreatmentSelection": "esse ut ipsum",
  "auditInfo": {
    "isDeleted": false,
    "createdBy": "quis esse ex est",
    "updatedBy": "sunt ut sint mollit veniam",
    "updatedDate": null,
    "createdDate": "1964-02-12T00:06:36.97Z"
  }
}
